firstName,lastName,birthDate,email,notes
sarah,Ward,2010-08-04,maddenchristina@gmail.com,Pay movement adult feel produce.
Heather,Watson,1970-01-01,,Understand little big anything.
Margaret,Rsuh,1970-01-01,,
CASSIDY,Duncan,2010-04-27,wilsontodd@gmail.com,Garden arrive difficult especially each.
TAMMY,Chnalder,2010-01-14,,Save father benefit bring.
Craig,Everett,2010-01-19,,Identify almost kid foreign moment on him respond.
riley,Rivera,2010-10-20,,Off weight animal school final practice deep why.
Christine,Tloyar,1970-01-01,,Attorney glass speak million.
ADRIAN,Pirce,1970-01-01,,Front little foreign financial country.
Aaron,Oliver,1970-01-01,,
Anna,Orr,1970-01-01,,
Deanna,Brwon,1970-01-01,,Analysis during safe remain response according.
MICHELE,Mcdonald,2010-11-09,,
Tara,Rodriguez,2010-11-09,ryan23@gmail.com,Cultural beyond management poor myself phone former.
ROGER,Guerrreo,2010-05-08,,Would condition modern by reason stand.
Hector,Potter,1970-01-01,,Serious material understand many.
JAKE,Howard,1970-01-01,,Method across not right.
gloria,Ward,1970-01-01,,Hour reduce one voice laugh.
gabrielle,Pena,2010-10-12,anthonyortiz@yahoo.com,Defense thus wonder former son.
Isaiah,Gzraa,2010-05-06,,
Clayton,Kim,2010-11-18,,
sally,Csobry,2010-02-02,,Course process form chance professional heavy.
Shawn,Odom,2010-06-21,charles13@yahoo.com,Say water or animal stock scene.
marissa,Jnoes,2010-09-08,,Cause suffer scientist without cell sport happen.
