firstName,lastName,birthDate,email,notes
laura,Boyd,1970-01-01,,Phone next visit lay.
RACHEL,Thomas,1970-01-01,,Act book soon country feeling.
jordan,Haburbd,2012-03-22,,You middle hotel PM matter bank.
patricia,Perez,1970-01-01,,Interest gun represent great fire.
Mia,Huang,2012-06-01,,Individual kid story expert.
Tamara,Pena,2012-07-07,,Marriage music two meet southern more institution note.
Tiffany,Ramos,2012-11-25,,Reveal professor TV radio white least agent.
Kimberly,Chang,2012-01-28,kara16@jones-gregory.org,Two member a grow more college.
JACK,Homffan,2012-02-17,justinrobinson@hotmail.com,Song determine more note.
JEREMIAH,Lnae,2012-10-09,,Attention today visit.
Louis,Greeiurtz,2012-11-27,duncanantonio@page.com,Democratic table sea anything prepare.
KAREN,Gray,2012-01-31,hollyruiz@sullivan-anderson.net,Economy within such guess effect stuff.
Gerald,Psanors,1970-01-01,,
Melanie,Dickerson,2012-02-01,marieanderson@james-wells.biz,Another decade cover beyond.
Jonathon,Fleming,2012-05-06,cannonjessica@patterson.com,Air standard campaign.
Kristina,Wllimais,1970-01-01,,
Tina,Singh,2012-10-25,,Lot drop positive authority bank yard.
Natasha,Moore,2012-07-25,,Stay sometimes tend raise form.
doris,Powell,1970-01-01,,
CRYSTAL,Ramirez,2012-05-19,stephanie58@wright-davis.com,Future evening although woman work lot.
virginia,Hall,2012-06-13,,Style per necessary sing.
Teresa,Perows,2012-09-12,,
COLLEEN,Haung,2012-02-26,,
adrienne,Stevens,1970-01-01,,Including candidate reduce.
katie,Jensen,2012-03-18,harriscraig@dorsey.com,Later right meeting clearly drive time.
Alexa,Vasquez,1970-01-01,,Pressure debate television reveal.
